{
  "metadata": {
    "simulation_timestamp": "2025-09-24T16:15:54.754246",
    "pandapipes_version": "0.8.0",
    "convergence_status": "converged",
    "total_iterations": 12,
    "simulation_duration_s": 35.5,
    "thermal_simulation_enabled": true,
    "auto_resize_enabled": true,
    "network_size": {
      "junctions": 50,
      "pipes": 75,
      "sources": 1,
      "sinks": 25
    }
  },
  "nodes": [
    {
      "id": "source_1",
      "x": 456259.85,
      "y": 5734163.4,
      "p_bar": 6.0,
      "t_c": 80.0,
      "node_type": "source",
      "mdot_kg_s": 15.5,
      "elevation_m": 120.0
    },
    {
      "id": "junction_1",
      "x": 456300.0,
      "y": 5734200.0,
      "p_bar": 5.8,
      "t_c": 78.5,
      "node_type": "junction",
      "elevation_m": 118.5
    },
    {
      "id": "sink_1",
      "x": 456350.0,
      "y": 5734250.0,
      "p_bar": 5.5,
      "t_c": 50.0,
      "node_type": "sink",
      "mdot_kg_s": 0.5,
      "elevation_m": 117.0
    }
  ],
  "pipes": [
    {
      "id": "pipe_1",
      "from_node": "source_1",
      "to_node": "junction_1",
      "length_m": 150.0,
      "dn_mm": 200,
      "v_ms": 1.2,
      "dp100m_pa": 280.0,
      "mdot_kg_s": 15.5,
      "t_seg_c": 79.2,
      "pipe_category": "mains",
      "q_loss_Wm": 45.2,
      "reynolds_number": 125000,
      "friction_factor": 0.018,
      "heat_transfer_coeff": 0.6
    },
    {
      "id": "pipe_2",
      "from_node": "junction_1",
      "to_node": "sink_1",
      "length_m": 75.0,
      "dn_mm": 50,
      "v_ms": 0.8,
      "dp100m_pa": 320.0,
      "mdot_kg_s": 0.5,
      "t_seg_c": 65.0,
      "pipe_category": "services",
      "q_loss_Wm": 12.5,
      "reynolds_number": 25000,
      "friction_factor": 0.022,
      "heat_transfer_coeff": 0.6
    }
  ],
  "kpis": {
    "v_max_ms": 1.8,
    "dp100m_max_pa": 350.0,
    "pump_kw": 8.5,
    "losses_mwh_a": 32.1,
    "dt_k": 30.0,
    "thermal_efficiency": 0.85,
    "total_flow_kg_s": 15.5,
    "network_length_km": 1.8,
    "supply_temp_c": 80.0,
    "return_temp_c": 50.0
  },
  "compliance": {
    "overall_status": "PASS",
    "standards_results": {
      "EN_13941": "PASS",
      "DIN_1988": "PASS",
      "VDI_2067": "PASS"
    },
    "violations": [],
    "auto_resize_results": {
      "iterations_completed": 1,
      "pipes_resized": 2,
      "final_compliance": true,
      "resize_history": [
        {
          "iteration": 1,
          "violations_found": 3,
          "pipes_resized": 2
        }
      ]
    }
  },
  "crs": {
    "epsg": 25832,
    "name": "ETRS89 / UTM zone 32N",
    "units": "m"
  },
  "units": {
    "pressure": "bar",
    "temperature": "C",
    "flow_rate": "kg_s",
    "power": "kW",
    "energy": "MWh",
    "length": "m",
    "velocity": "m_s",
    "diameter": "mm"
  },
  "thermal_analysis": {
    "pump_power_analysis": {
      "total_pump_power_w": 8500.0,
      "total_pump_power_kw": 8.5,
      "pump_efficiency": 0.75,
      "pipe_details": [
        {
          "pipe_id": "pipe_1",
          "pressure_drop_pa": 420.0,
          "volumetric_flow_m3_s": 0.016,
          "pump_power_w": 7000.0
        },
        {
          "pipe_id": "pipe_2",
          "pressure_drop_pa": 240.0,
          "volumetric_flow_m3_s": 0.0005,
          "pump_power_w": 1500.0
        }
      ]
    },
    "thermal_loss_analysis": {
      "total_thermal_loss_w": 32100.0,
      "total_thermal_loss_kw": 32.1,
      "pipe_details": [
        {
          "pipe_id": "pipe_1",
          "surface_area_m2": 94.2,
          "heat_transfer_coeff": 0.6,
          "delta_t_k": 69.2,
          "thermal_loss_w": 28000.0
        },
        {
          "pipe_id": "pipe_2",
          "surface_area_m2": 11.8,
          "heat_transfer_coeff": 0.6,
          "delta_t_k": 55.0,
          "thermal_loss_w": 4100.0
        }
      ]
    },
    "temperature_profiles": {
      "network_temp_drop_c": 30.0,
      "max_inlet_temp_c": 80.0,
      "min_outlet_temp_c": 50.0,
      "pipe_profiles": [
        {
          "pipe_id": "pipe_1",
          "inlet_temp_c": 80.0,
          "outlet_temp_c": 78.5,
          "temp_drop_c": 1.5,
          "thermal_loss_w": 28000.0
        },
        {
          "pipe_id": "pipe_2",
          "inlet_temp_c": 78.5,
          "outlet_temp_c": 50.0,
          "temp_drop_c": 28.5,
          "thermal_loss_w": 4100.0
        }
      ]
    }
  }
}